{
  "meta": {
    "project_name": "Altitude Coffee Roasters",
    "industry": "specialty coffee",
    "target_audience": "Urban professionals 28–42, prioritise provenance and craft over convenience, already buy direct-trade beans, follow roasters on Instagram, read Standart magazine, treat a Saturday morning cup as a ritual rather than a caffeine fix.",
    "tone_keywords": ["unhurried", "tactile", "precise", "warm", "uncompromising"]
  },

  "creative_direction": {
    "concept": "Every bag of coffee is a compressed journey from a specific hillside to your cup — the site makes that altitude, terroir, and human chain viscerally felt.",
    "narrative": "The visitor lands on darkness broken only by steam curling off a single pour — no text, just atmosphere. Scrolling down reveals the origin map: exact farm coordinates, elevation, harvest date. The middle act introduces the roasters by name, with their hand-annotated tasting notes. The site closes on the subscription CTA framed not as a product but as 'a standing order from the mountain.'",
    "emotional_tone": "The quiet pride of someone who has found exactly the thing they were looking for.",
    "signature_moment": "On the origin section, hovering a farm pin on the map triggers a 3-second ambient field recording from that specific farm (birds, wind, distant machinery) while the elevation number counts up in large type — making the geography audible.",
    "brand_personality": "A seasoned Q-grader who speaks in exact descriptors ('dried apricot, brown butter, 72% cacao') rather than superlatives. Would never say 'artisanal' or 'passionate'. Comfortable with silence. Wears an apron with burn marks."
  },

  "ux_structure": {
    "sitemap": [
      {
        "id": "hero",
        "label": "Opening",
        "purpose": "Create immediate atmosphere; communicate that this is not a commodity brand — zero copy, pure sensation."
      },
      {
        "id": "origins",
        "label": "Where It Grows",
        "purpose": "Build credibility and emotional connection through farm-level provenance — interactive map with audio.",
        "children": [
          { "id": "origins-map", "label": "Farm Map", "purpose": "Let visitors explore the sourcing geography and trigger farm audio snippets." },
          { "id": "origins-detail", "label": "Farm Profile", "purpose": "Slide-in panel with farmer portrait, elevation, processing method, and harvest window." }
        ]
      },
      {
        "id": "roasters",
        "label": "The People",
        "purpose": "Humanise the craft; introduce the two roasters by name with handwritten tasting notes."
      },
      {
        "id": "offerings",
        "label": "Current Roasts",
        "purpose": "Convert interest into selection — present 3–4 active single-origins with buy/subscribe actions."
      },
      {
        "id": "subscription",
        "label": "Standing Order",
        "purpose": "Drive recurring revenue; reframe subscription as an ongoing relationship, not a discount programme."
      },
      {
        "id": "footer",
        "label": "Footer",
        "purpose": "Wholesale enquiries, press, and the only social link on the site (Instagram)."
      }
    ],
    "conversion_flow": "Hero creates atmosphere → origins section earns trust through provenance specificity → roasters section adds human accountability → offerings lets them pick a bag → subscription CTA captures them for repeat revenue. The path from hero to 'add to cart' is achievable in 4 scroll steps with no lateral navigation required.",
    "navigation_pattern": "Wordmark only in top-left, no nav links on desktop — the page rewards linear scrolling. A minimal dot-indicator on the right edge marks section position. At ≤768px a 24px hamburger opens a full-screen overlay nav with all section labels."
  },

  "design_system": {
    "typography": {
      "heading_font": {
        "name": "Canela",
        "weight": "300,400",
        "source": "custom"
      },
      "body_font": {
        "name": "Söhne",
        "weight": "400,500",
        "source": "custom"
      },
      "scale": {
        "display": "7.5rem",
        "h1": "4.5rem",
        "h2": "2.75rem",
        "h3": "1.75rem",
        "lead": "1.25rem",
        "body": "1rem",
        "small": "0.875rem",
        "caption": "0.75rem"
      }
    },
    "color_palette": [
      { "name": "Wet Earth",    "hex": "#1C1512", "role": "background" },
      { "name": "Raw Parchment","hex": "#F2EDE4", "role": "primary-text" },
      { "name": "Blonde Roast", "hex": "#C8A96E", "role": "accent" },
      { "name": "Dried Cherry", "hex": "#8B2E2E", "role": "highlight" },
      { "name": "Steam",        "hex": "#E8E3DA", "role": "surface" },
      { "name": "Graphite",     "hex": "#3A3530", "role": "secondary-surface" }
    ],
    "spacing_scale": {
      "xs":  "0.25rem",
      "sm":  "0.5rem",
      "md":  "1rem",
      "lg":  "1.5rem",
      "xl":  "2.5rem",
      "2xl": "4rem",
      "3xl": "7rem",
      "4xl": "12rem"
    },
    "components": [
      {
        "name": "FarmPin",
        "description": "SVG map marker that pulses on hover, triggers audio playback and a slide-in FarmPanel. Active state shows elevation label in Canela display size."
      },
      {
        "name": "FarmPanel",
        "description": "Slide-in right-side drawer showing farmer portrait (greyscale), farm name, country, altitude in masl, processing method badge, and harvest month range."
      },
      {
        "name": "RoasterCard",
        "description": "Portrait photo in a ragged-edge mask, name in Canela h3, handwriting-style SVG of a tasting note overlaid at 40° rotation."
      },
      {
        "name": "CoffeeCard",
        "description": "Product card with origin flag, process badge (washed/natural/honey), flavour wheel fragment, price, and two CTAs: 'Buy once' and 'Add to standing order'."
      },
      {
        "name": "ElevationCounter",
        "description": "Large Canela display-size number that counts up from 0 to the farm's actual masl value over 2.4s when the farm pin is activated."
      },
      {
        "name": "AmbientAudioPlayer",
        "description": "Invisible audio element, auto-plays on farm pin hover, fades out after 3s or on mouseout. No visible controls — sound is the surprise."
      },
      {
        "name": "SectionDotNav",
        "description": "Vertical stack of 6 dots on the right edge, active dot fills with Blonde Roast accent colour. Clicks scroll to the corresponding section."
      },
      {
        "name": "SubscriptionToggle",
        "description": "Segmented control: 'Single bag' / 'Standing order'. Selecting standing order exposes frequency selector (2-weekly / 4-weekly) and shows a small price-per-bag saving."
      }
    ]
  },

  "motion_spec": {
    "global_principles": [
      "Nothing moves unless scroll or pointer caused it — no auto-playing carousels or looping animations.",
      "Easing is always decelerating (ease-out or custom cubic-bezier) — the site never feels rushed.",
      "Opacity and transform are the only animated properties; no layout-triggering animations.",
      "Reduced-motion media query disables all transitions and parallax, substituting instant cuts."
    ],
    "per_section": [
      {
        "section_id": "hero",
        "scroll_behavior": "Steam particle canvas parallaxes at 0.25× scroll rate. Background stays fixed. At 80vh scroll depth, the canvas opacity fades to 0 over 40px.",
        "transitions": "On load: full-screen black fades to scene over 1800ms after a 400ms initial hold. Wordmark fades in from opacity 0 at translateY(12px) after 1200ms.",
        "timing": "1800ms cubic-bezier(0.16, 1, 0.3, 1)"
      },
      {
        "section_id": "origins",
        "scroll_behavior": "Section pins for 150vh of scroll travel. During the pin, the SVG world map scales from 0.85 to 1.0 and farm pins stagger-fade in at 80ms intervals.",
        "transitions": "Section enter: map container clips in from bottom using clip-path(inset(100% 0 0 0)) → inset(0%). Farm pins scale from 0 to 1 with a spring overshoot.",
        "timing": "Map clip: 700ms cubic-bezier(0.16, 1, 0.3, 1). Pin spring: 500ms cubic-bezier(0.34, 1.56, 0.64, 1)."
      },
      {
        "section_id": "origins-detail",
        "scroll_behavior": "Drawer is pointer-triggered, not scroll-driven. Slides in from right at translateX(100%) → translateX(0).",
        "transitions": "Panel open: translateX + overlay fade-in simultaneously. Close: reverse, 50ms faster.",
        "timing": "380ms cubic-bezier(0.16, 1, 0.3, 1)"
      },
      {
        "section_id": "roasters",
        "scroll_behavior": "Two roaster cards enter from opposite sides (left and right) as the section scrolls into the viewport center.",
        "transitions": "Left card: translateX(-60px) opacity 0 → natural. Right card: translateX(60px) opacity 0 → natural. Tasting-note SVG overlays rotate from -50° → -40° while fading in.",
        "timing": "600ms cubic-bezier(0.16, 1, 0.3, 1), staggered 120ms between cards."
      },
      {
        "section_id": "offerings",
        "scroll_behavior": "Cards stagger-enter from below as they cross the 80% viewport threshold. No scroll pinning.",
        "transitions": "Each CoffeeCard: translateY(32px) opacity 0 → natural, 80ms stagger per card.",
        "timing": "500ms cubic-bezier(0.16, 1, 0.3, 1)"
      },
      {
        "section_id": "subscription",
        "scroll_behavior": "Section background fades from Wet Earth to a slightly lighter Graphite as it enters, giving a subtle 'stepping into a warmer room' feel.",
        "transitions": "Headline enters at translateY(20px) opacity 0. Toggle and frequency selector fade in 200ms later.",
        "timing": "650ms cubic-bezier(0.16, 1, 0.3, 1)"
      },
      {
        "section_id": "footer",
        "scroll_behavior": "No scroll animation. Static.",
        "transitions": "None.",
        "timing": "N/A"
      }
    ]
  },